{
  "format": "ROAX-TYPE-MAP/1",
  "typeMapVersion": "1.0.0",
  "recordType": "sg.gov.moh.pdt-healthcert",
  "schemaVersion": "2.0",
  "scope": {
    "kind": "profile"
  },
  "sourceSchemas": [
    {
      "sourceId": "references/schemata/src/sg/gov/moh/fhir/4.0.1/lite-schema.json",
      "kind": "git",
      "repositoryUri": "https://github.com/Open-Attestation/schemata.git",
      "path": "src/sg/gov/moh/fhir/4.0.1/lite-schema.json",
      "commit": "09fa75eef40ad7c44a03860272c4d6e6e0f0ddfa"
    },
    {
      "sourceId": "references/schemata/src/sg/gov/moh/pdt-healthcert/2.0/schema.json",
      "kind": "git",
      "repositoryUri": "https://github.com/Open-Attestation/schemata.git",
      "path": "src/sg/gov/moh/pdt-healthcert/2.0/schema.json",
      "commit": "09fa75eef40ad7c44a03860272c4d6e6e0f0ddfa"
    }
  ],
  "extensionPoints": [
    {
      "prefix": [],
      "note": "The PDT root permits additional properties, but each added path still needs an issuer extension with type evidence."
    }
  ],
  "addedSelectors": [],
  "coverage": {
    "concretePathCardinality": "infinite",
    "states": 317,
    "keyTransitions": 639,
    "indexTransitions": 160,
    "resolvedOutputs": 310,
    "unresolvedOutputStates": 2,
    "byTag": {
      "1": 7,
      "2": 80,
      "3": 9,
      "4": 2,
      "6": 159,
      "7": 53
    },
    "byBasis": {
      "schema-type": 55,
      "schema-container-type": 212,
      "schema-const": 2,
      "fhir-named-primitive": 4,
      "schema-enum": 30,
      "fhir-element-name": 7
    },
    "structurallyUntypedObjectSourceNodes": 65,
    "structurallyUntypedObjectStates": 63,
    "notes": [
      "Only the PDT base schema is normative for this base map.",
      "Clinic, endorsed, OpenAttestation and Notarise fields are proposals until the profile selects those composed schemas explicitly."
    ]
  },
  "automaton": {
    "representation": "structured-path-dfa/1",
    "start": "s0",
    "states": [
      {
        "id": "s0",
        "keys": [
          {
            "key": "fhirBundle",
            "to": "s1"
          },
          {
            "key": "fhirVersion",
            "to": "s2"
          },
          {
            "key": "id",
            "to": "s3"
          },
          {
            "key": "logo",
            "to": "s4"
          },
          {
            "key": "type",
            "to": "s5"
          },
          {
            "key": "validFrom",
            "to": "s6"
          },
          {
            "key": "version",
            "to": "s7"
          }
        ]
      },
      {
        "id": "s1",
        "keys": [
          {
            "key": "entry",
            "to": "s8"
          },
          {
            "key": "id",
            "to": "s9"
          },
          {
            "key": "identifier",
            "to": "s10"
          },
          {
            "key": "implicitRules",
            "to": "s11"
          },
          {
            "key": "language",
            "to": "s12"
          },
          {
            "key": "link",
            "to": "s13"
          },
          {
            "key": "meta",
            "to": "s14"
          },
          {
            "key": "resourceType",
            "to": "s15"
          },
          {
            "key": "signature",
            "to": "s16"
          },
          {
            "key": "timestamp",
            "to": "s17"
          },
          {
            "key": "total",
            "to": "s18"
          },
          {
            "key": "type",
            "to": "s19"
          }
        ],
        "structurallyUntypedObject": true
      },
      {
        "id": "s2",
        "bindings": [
          {
            "jsonKind": "string",
            "tag": 2,
            "basis": [
              "schema-type"
            ],
            "sources": [
              "references/schemata/src/sg/gov/moh/pdt-healthcert/2.0/schema.json#/properties/fhirVersion"
            ]
          }
        ]
      },
      {
        "id": "s3",
        "bindings": [
          {
            "jsonKind": "string",
            "tag": 2,
            "basis": [
              "schema-type"
            ],
            "sources": [
              "references/schemata/src/sg/gov/moh/pdt-healthcert/2.0/schema.json#/properties/id"
            ]
          }
        ]
      },
      {
        "id": "s4",
        "bindings": [
          {
            "jsonKind": "string",
            "tag": 2,
            "basis": [
              "schema-type"
            ],
            "sources": [
              "references/schemata/src/sg/gov/moh/pdt-healthcert/2.0/schema.json#/properties/logo"
            ]
          }
        ]
      },
      {
        "id": "s5",
        "anyIndex": "s20",
        "bindings": [
          {
            "jsonKind": "string",
            "tag": 2,
            "basis": [
              "schema-type"
            ],
            "sources": [
              "references/schemata/src/sg/gov/moh/pdt-healthcert/2.0/schema.json#/definitions/PdtTypes"
            ]
          }
        ]
      },
      {
        "id": "s6",
        "bindings": [
          {
            "jsonKind": "string",
            "tag": 2,
            "basis": [
              "schema-type"
            ],
            "sources": [
              "references/schemata/src/sg/gov/moh/pdt-healthcert/2.0/schema.json#/properties/validFrom"
            ]
          }
        ]
      },
      {
        "id": "s7",
        "bindings": [
          {
            "jsonKind": "string",
            "tag": 2,
            "basis": [
              "schema-type"
            ],
            "sources": [
              "references/schemata/src/sg/gov/moh/pdt-healthcert/2.0/schema.json#/properties/version"
            ]
          }
        ]
      },
      {
        "id": "s8",
        "anyIndex": "s21",
        "bindings": [
          {
            "jsonKind": "array",
            "tag": 6,
            "basis": [
              "schema-container-type"
            ],
            "sources": [
              "references/schemata/src/sg/gov/moh/fhir/4.0.1/lite-schema.json#/definitions/Bundle/properties/entry"
            ]
          }
        ]
      },
      {
        "id": "s9",
        "bindings": [
          {
            "jsonKind": "string",
            "tag": 2,
            "basis": [
              "schema-type"
            ],
            "sources": [
              "references/schemata/src/sg/gov/moh/fhir/4.0.1/lite-schema.json#/definitions/id"
            ]
          }
        ]
      },
      {
        "id": "s10",
        "keys": [
          {
            "key": "assigner",
            "to": "s22"
          },
          {
            "key": "extension",
            "to": "s23"
          },
          {
            "key": "id",
            "to": "s24"
          },
          {
            "key": "period",
            "to": "s25"
          },
          {
            "key": "system",
            "to": "s11"
          },
          {
            "key": "type",
            "to": "s26"
          },
          {
            "key": "use",
            "to": "s27"
          },
          {
            "key": "value",
            "to": "s24"
          }
        ],
        "bindings": [
          {
            "jsonKind": "object",
            "tag": 7,
            "basis": [
              "schema-container-type"
            ],
            "sources": [
              "references/schemata/src/sg/gov/moh/fhir/4.0.1/lite-schema.json#/definitions/Identifier"
            ]
          }
        ],
        "structurallyUntypedObject": true
      },
      {
        "id": "s11",
        "bindings": [
          {
            "jsonKind": "string",
            "tag": 2,
            "basis": [
              "schema-type"
            ],
            "sources": [
              "references/schemata/src/sg/gov/moh/fhir/4.0.1/lite-schema.json#/definitions/uri"
            ]
          }
        ]
      },
      {
        "id": "s12",
        "bindings": [
          {
            "jsonKind": "string",
            "tag": 2,
            "basis": [
              "schema-type"
            ],
            "sources": [
              "references/schemata/src/sg/gov/moh/fhir/4.0.1/lite-schema.json#/definitions/code"
            ]
          }
        ]
      },
      {
        "id": "s13",
        "anyIndex": "s28",
        "bindings": [
          {
            "jsonKind": "array",
            "tag": 6,
            "basis": [
              "schema-container-type"
            ],
            "sources": [
              "references/schemata/src/sg/gov/moh/fhir/4.0.1/lite-schema.json#/definitions/Bundle/properties/link"
            ]
          }
        ]
      },
      {
        "id": "s14",
        "keys": [
          {
            "key": "extension",
            "to": "s29"
          },
          {
            "key": "id",
            "to": "s24"
          },
          {
            "key": "lastUpdated",
            "to": "s17"
          },
          {
            "key": "profile",
            "to": "s30"
          },
          {
            "key": "security",
            "to": "s31"
          },
          {
            "key": "source",
            "to": "s11"
          },
          {
            "key": "tag",
            "to": "s32"
          },
          {
            "key": "versionId",
            "to": "s9"
          }
        ],
        "bindings": [
          {
            "jsonKind": "object",
            "tag": 7,
            "basis": [
              "schema-container-type"
            ],
            "sources": [
              "references/schemata/src/sg/gov/moh/fhir/4.0.1/lite-schema.json#/definitions/Meta"
            ]
          }
        ],
        "structurallyUntypedObject": true
      },
      {
        "id": "s15",
        "bindings": [
          {
            "jsonKind": "string",
            "tag": 2,
            "basis": [
              "schema-const"
            ],
            "sources": [